NICHE,SUB NICHE,KEY WORD
anime,my hero academia,anime manga japanese painting my hero academia all might Izuku midoriya deku mirio lemillion kacchan
,pokemon,
,one piece,anime manga japanese painting one piece onepiece zoro sanji ace law robin nami straw hat pirates
,naruto,anime manga japanese painting sakura akatsuki minato madara obito ninja shinobi uchiha jiraiya shikamaru tendo
,dragon ball,anime manga japanese painting dragonball dragon ball z super son goku vegeta trunks piccolo gohan
,one punch man,anime manga japanese painting onepunchman saitama genos tatsumaki fubuki sonic garou zombieman king bang bat
,attack on titan,anime manga japanese painting attack on titan levi eren mikasa armin erwin jean annie hange
,fairy tail,anime manga japanese painting fairy tail lucy natsu erza gray juvia gajeel happy levy wendy
,tokyo ghoul,anime manga japanese painting tokyo ghoul kaneki ken kirishima touka tsukiyama suzuya kamishiro uta nagachika
,jojo bizarre adventure,anime manga japanese painting jojo bizarre adventure kujo jotaro dio brando kakyoin giorno jolyne joseph
,cowboy bebop,anime manga japanese painting cowboy bebop spike spiegel faye valentine edward ein jet black julia
,hunter x hunter,anime manga japanese painting hunter x hunter killua zoldyck kurapika hisoka gon freecss neferpitou Illumi
,sailor moon,anime manga japanese painting sailor moon luna neptune saturn jupiter mars venus pluto mercury
,death note,anime manga japanese painting lawliet L l light yagami ryuk kira
,demon slayer,anime manga japanese painting demon kimetsu yaiba tanjiro kamado nezuko inosuke zenitsu shinobu giyu kanao
,bleach,anime manga japanese bleach painting ichigo kurosaki rukia kuchiki toshiro hitsugaya byakuya kuchiki Gotei 13
,sword art online,anime manga japanese painting sword art online sao kirito sinon asuna alice eugeo leafa yuuki yui
,black butler,anime manga japanese painting black butler kuroshitsuji sebastian michaelis ciel phantomhive undertaker grell sutcliff
,berserk,anime manga japanese painting berserk Berserk guts skull knight schierke zodd judeau
,fullmetal alchemist,anime manga japanese painting fullmetal alchemist brotherhood edward elric roy mustang riza alphonse winry rockbell
,yuri on ice,anime manga japanese painting yuri on ice Yuri On Ice yuri plisetsky katsuki victor nikiforov
,neon genesis evangelion,anime manga japanese painting neon genesis evangelion rei ayanami asuka langley soryu shinji ikari misato katsuragi
,soul eater,anime manga japanese painting soul eater franken stein evans death tsubaki nakatsukasa maka albarn crona
,yugioh,anime manga japanese painting yu gi oh yugioh yugi bakura seto kaiba Yugi akiza izinski
,re zero,anime manga japanese painting re zero re:zero rem emilia ram beatrice crusch echidna puck natsuki
,assassination classroom,anime manga japanese painting assassination classroom karma akabane koro sensei nagisa shiota tadaomi karasuma itona
,haikyuu,anime manga japanese painting haikyuu! haikyuu kageyama tobio shouyou nishinoya yuu tohru kei koshi
,kill la kill,anime manga japanese painting kill la kill ryuko matoi satsuki kiryuin mako nonon nui Ira
,samurai champloo,anime manga japanese painting samurai champloo mugen kasumi fuu jin Samurai Champloo
,inuyasha,anime manga japanese painting inuyasha sesshomaru sango kagome kikyo rin miroku shippo kirara tetsusaiga koga
,yu yu hakusho,anime manga japanese painting yu yu hakusho yusuke urameshi hiei kurama kazuma botan keiko koenma
,ghost in the shell ,anime manga japanese painting ghost in the shell mokoto kusanagi tachikoma
,gurren lagann,anime manga japanese painting gurren lagann kamina simon yoko littner viral nia teppelin boota darry
,high school dxd,anime manga japanese painting high school dxd akeno himejima rias gremory koneko toujou xenovia asia
,steins gate,anime manga japanese painting steins gate rintaro okabe kurisu makise Itaru mayuri suzuha kagari faris
,your lie in april,anime manga japanese painting your lie in april kaori miyazano kousei arima ryouta emi tsubaki
,a silent voice,anime manga japanese painting a silent voice shouko nishimiya shouya ishida yuzuru nishimiya naoka ueno
,code geass,anime manga japanese painting code geass c.c lelouch cc suzaku kururugi kallen stadtfeld nunnally lamperouge
,no game no life,anime manga japanese painting no game no life shiro sora stephanie dola jibril fiel nilvalen
,blue exorcist,anime manga japanese painting blue exorcist rin okumura yukio mephisto pheles shiemi moriyama
,akame ga kill,anime manga japanese painting akame ga kill esdeath lubbock tatsumi mine chelsea leone najenda
,noragami,anime manga japanese painting noragami yato yukine bishamonten bishamon kofuku hiyori
,seven deadly sins,anime manga japanese painting seven deadly sins taizai nanatsu meliodas ban king diane elizabeth merlin gowthe
,gintama,anime manga japanese painting gintama gintoki sakata kagura okita sougo hijikata toshiro takasugi yamazaki
,trigun,anime manga japanese painting trigun vash the stampede nicholas wolfwood millions knives legato bluesummers midvalley
,angel beats,anime manga japanese painting angel beats kanade tachibana Angel yuri nakamura yurippe otonashi yui hideki
,rurouni kenshin,anime manga japanese painting rurouni kenshin himura kenshin hiko seijuro shishio makoto saito hajime sanosuke
,elfen lied,anime manga japanese painting elfen lied lucy kaede nana mariko mayu nyu yuka
,food wars,anime manga japanese painting food wars erina nakiri souma yukihira alice ikumi tadokoro rindou hisako
,spirited away,anime manga japanese painting 
,overlord,anime manga japanese painting overlord momonga ainz ooal gown albedo shalltear bloodfallen aura bella fiora
,princess mononoke,anime manga japanese painting princess mononoke san ashitaka forest spirit moro
,black clover,anime manga japanese painting black clover asta yami sukehiro yuno noelle silva nero secre swallowtail
,perfect blue,anime manga japanese painting
,akira (1988),anime manga japanese painting shotaro kaneda tetsuo shima kei kaori
,howl’s moving castle,anime manga japanese painting
,your name,anime manga japanese painting your name taki tachibana mitsuha miyamizu 
,my neighbor totoro,anime manga japanese painting
,kiki’s delivery service,anime manga japanese painting
,grave of the fireflies,anime manga japanese painting
,the promised neverland,anime manga japanese painting the promised neverland yakusoku no emma norman ray 
,the rising of the shield hero,anime manga japanese painting the rising of the shield hero naofumi iwatani raphtalia filo melty fitoria
,dororo,anime manga japanese painting dororo hyakkimaru jukai tahomaru mio
,fate stay night,anime manga japanese painting fate stay night saber gilgamesh rin tohsaka matou sakura emiya shirou
,kaguya sama love is war,anime manga japanese painting love is war chika fujiwara yuu ishigami miyuki shirogane shinomiya ai hayasaka
,date a live,"anime manga japanese painting date a live kurumi tokisaki tohka yuzuru kaguya origami miku kotori
"
,persona 5 the animation,anime manga japanese painting persona game gaming akira kurusu joker futaba sakura makoto niijima
,darling in the franxx,anime manga japanese painting darling in the franxx zero two ichigo hiro kokoro mitsuru goro
,danganronpa,anime manga japanese painting danganronpa monokuma chiaki nanami junko enoshima kokichi ouma makoto naegi chihiro
,boruto,anime manga japanese painting boruto naruto sasuke kakashi kawaki shinki momoshiki sarada himawari mitsuki shikadai
,dr stone,anime manga japanese painting dr stone senku ishigami kohaku chrome suika gen asagiri tsukasa shishio
,goblin slayer,anime manga japanese painting goblin slayer priestess sword maiden guild girl cow girl high elf archer
,aggretsuko,anime manga japanese painting aggretsuko retsuko haida tadano fenneko anai washimi ookami
,ponyo,anime manga japanese painting ponyo sousuke Ponyo
,vinland saga,anime manga japanese painting vinland saga askeladd thorkell thorfinn canute thors
,angels of death,anime manga japanese painting angels of death rachel gardner ray isaac foster zack danny daniel
,that time i got reincarnated as a slime,anime manga japanese painting that time i got reincarnated as a slime rimuru tempest milim
,azur lane,anime manga japanese painting game azur lane formidable belfast unicorn prinz eugen atago retrofit ayanami
,konosuba,anime manga japanese painting konosuba megumin aqua darkness kazuma sato yunyun eris aqua wiz chris
,worldend,
,re creators,anime manga japanese painting re:creators re creators altair souta mizushino selesia upitiria rui kanoya mamika
,kakegurui,anime manga japanese painting kakegurui compulsive gambler kirari momobami yumeko jabami meari saotome yumemi yumemite
,violet evergarden,anime manga japanese painting violet evergarden gilbert bougainvillea cattleya hodgins baudelaire benedict blue iris cannary
,saga of tanya the evil,anime manga japanese painting saga of tanya the evil degurechaff viktoriya ivanovna serebryakov erich
,the ancient magus' bride,anime manga japanese painting the ancient magus bride elias ainsworth chise hatori silky silver ruth
,blend s,anime manga japanese painting blend-s blend s hideri kanzaki kaho hinata maika sakuranomiya mafuyu hoshikawa
,domestic girlfriend,anime manga japanese painting domestic girlfriend tachibana rui tachibana hina natsuo fujii
,bungo stray dogs,anime manga japanese painting bungo stray dogs nakajima atsushi dazai osamu akutagawa ryunosuke yosano akiko
,devilman crybaby,anime manga japanese painting devilman crybaby fudo ryo asuka miki makimura 
,log horizon,anime manga japanese painting log horizon shiroe nyanta akatsuki kanami henrietta soujiro seta krusty minori
,afro samurai,anime manga japanese painting afro samurai afro ninja ninja jinno sio okiku
,ascendance of a bookworm,anime manga japanese painting ascendance of a bookworm main tuuli freida ferdinand lutz vilfried
,mob psycho 100,anime manga japanese painting mob psycho 100 arataka reigen shigeo kageyama teruki hanazawa ritsu kageyama
,hinamatsuri,anime manga japanese painting hinamatsuri nitta hina yoshifumi nitta anzu mao hitomi mishima
,banana fish,anime manga japanese painting banana fish ash lynx okumura eiji shorter wong sing soo ling
,cells at work,anime manga japanese painting cells at work platelets macrophage red blood erythrocyte u1146 neutrophil eosinophil
,miss kobayashi dragon maid,anime manga japanese painting miss kobayashi dragon maid kanna kamui tohru lucoa elma riko saikawa
,detective conan,anime manga japanese painting case closed detective conan vi graythorn conan edogawa phantom thief kid
,tower of god,anime manga japanese painting tower of god twenty fifth baam bam rachel khun androssi zahard
,future diary,anime manga japanese painting future diary minene uryuu ninth yuno gasai aru akise yukiteru amano
,weathering with you,anime manga japanese painting weathering with you amano hina morishima hodaka suga natsumi nagi
,fire force,anime manga japanese painting fire force kotatsu tamaki kusakabe shinra benimaru shinmon arthur boyle
,castlevania,anime manga japanese painting castlevania alucard maria renard arikado genya lisa
,the devil is a part timer,anime manga japanese painting the devil is a part timer sasaki maou yusa ashiya urushihara
,baki the grappler,anime manga japanese painting baki the grappler hanma yujiro hanma
,dorohedoro,anime manga japanese painting dorohedoro noi shin nikaido ebisu risu kaiman kikurage en
,kengan ashura,anime manga japanese painting kengan ashura tokita ohma kiryu setsuna wakatsuki takeshi
,ultraman,anime manga japanese painting poster ultraman
,seraph of the end,anime manga japanese painting seraph of the end hyakuya yuuichirou mikaela hyakuya krul tepes shinoa
,rascal does not dream of a dreaming girl,
,drifters,anime manga japanese painting drifters shimazu toyohisa nasu suketaka yoichi oda nobunaga hijikata toshizo kanno
,durarara,anime manga japanese painting durarara celty helmet orihara izaya heiwajima shizuo kida masaomi ryuugamine mikado
,clannad,anime manga japanese painting clannad after story furukawa nagisa fujibayashi kyou ichinose kotomi okazaki tomoya
,psycho pass,anime manga japanese painting psycho pass kogami shinya kougami akane tsunemori nobuchika ginoza shogo makishima
,maid sama,anime manga japanese painting maid sama ayuzawa misaki usui takumi hyoudou aoi kurosaki ryuunosuke
